{
  "schemaVersion": "1.0",
  "runId": "20260801-example-a1b2",
  "taskId": "BACKEND-01",
  "graphVersion": 1,
  "rootBaseCommit": "1111111111111111111111111111111111111111",
  "directDependencies": [
    {
      "taskId": "CONTRACT-01",
      "commit": "2222222222222222222222222222222222222222"
    }
  ],
  "transitiveDependencies": [
    {
      "taskId": "CONTRACT-01",
      "commit": "2222222222222222222222222222222222222222"
    }
  ],
  "inputCommit": "3333333333333333333333333333333333333333",
  "inputTree": "4444444444444444444444444444444444444444",
  "compositionAlgorithm": "topological-task-id-v1",
  "snapshotMetadataSha256": "5555555555555555555555555555555555555555555555555555555555555555"
}
